{
  "schema_version": 1,
  "contract_key": "spec-014.gemini-evidence-development-automation.v1",
  "spec_key": "014-gemini-evidence-intake-automation",
  "review_state": "draft",
  "source_revision": {
    "base_branch": "main",
    "base_sha": "b684537eb79710fa1744a955bcce95f9a0b0dae0",
    "generated_at": "2026-08-01T11:50:00Z",
    "work_map_fingerprint": "f282e53d6620e906ca48ff703e2e0b65c5fde6b10d20194b596c2bd2e687f235"
  },
  "authority_boundary": {
    "contract_is_authority": false,
    "allowed_automation": [
      "validate contract references and lifecycle states",
      "calculate ready and blocked tasks",
      "generate bounded implementation work packets",
      "draft issues, PR scopes, checklists, and delivery reports",
      "request authoritative evidence from existing governed tools",
      "resume from stable checkpoints without replaying verified work"
    ],
    "forbidden_automation": [
      "invent or approve capability envelopes",
      "invent typed confirmations or human approvals",
      "call Gemini or another provider without separate runtime authority",
      "create or apply migrations without migration authority",
      "grant Drive, tenant, Brand, account, or repository permissions",
      "merge, deploy, publish externally, delete evidence, or force-push from this contract alone",
      "declare completion from narrative without exact authoritative evidence"
    ],
    "nested_authority_required": true
  },
  "requirements": [
    {"id":"FR-001","title":"Provide a schema-valid machine-readable development contract","priority":"P0","state":"in_progress","owner_class":"spec-owner","operation_path_refs":["OP-001"],"acceptance_refs":["AC-001","AC-002"]},
    {"id":"FR-002","title":"Give every automated task complete immutable delivery bindings","priority":"P0","state":"in_progress","owner_class":"spec-owner","operation_path_refs":["OP-001"],"acceptance_refs":["AC-002","AC-003"]},
    {"id":"FR-003","title":"Fail closed on unresolved or missing contract references","priority":"P0","state":"in_progress","owner_class":"platform-governance","operation_path_refs":["OP-001"],"acceptance_refs":["AC-001","AC-003"]},
    {"id":"FR-004","title":"Represent distinct planning and delivery lifecycle states","priority":"P0","state":"in_progress","owner_class":"platform-governance","operation_path_refs":["OP-001","OP-009"],"acceptance_refs":["AC-002","AC-018"]},
    {"id":"FR-005","title":"Block readiness while dependencies or governance decisions remain unresolved","priority":"P0","state":"in_progress","owner_class":"platform-governance","operation_path_refs":["OP-001"],"acceptance_refs":["AC-003"]},
    {"id":"FR-006","title":"Bind every generated work packet to stable scope and plan identity","priority":"P0","state":"blocked","owner_class":"repository-automation","operation_path_refs":["OP-001"],"acceptance_refs":["AC-003"]},
    {"id":"FR-007","title":"Keep planning contracts separate from mutation authority","priority":"P0","state":"in_progress","owner_class":"platform-security","operation_path_refs":["OP-001","OP-009"],"acceptance_refs":["AC-003","AC-018"]},
    {"id":"FR-008","title":"Support idempotent checkpoints and deterministic resume","priority":"P0","state":"blocked","owner_class":"repository-automation","operation_path_refs":["OP-001","OP-008"],"acceptance_refs":["AC-003","AC-010"]},
    {"id":"FR-009","title":"Require tasks checklists and authoritative delivery evidence for completion","priority":"P0","state":"in_progress","owner_class":"platform-governance","operation_path_refs":["OP-009"],"acceptance_refs":["AC-018"]},
    {"id":"FR-010","title":"Report implemented verified blocked deferred and unowned work separately","priority":"P1","state":"blocked","owner_class":"repository-automation","operation_path_refs":["OP-001","OP-009"],"acceptance_refs":["AC-003","AC-018"]},
    {"id":"FR-011","title":"Resolve authenticated or bounded intake identity before scope","priority":"P0","state":"blocked","owner_class":"identity-platform","operation_path_refs":["OP-002"],"acceptance_refs":["AC-004","AC-006"]},
    {"id":"FR-012","title":"Resolve tenant workspace Brand account and resources from canonical authority","priority":"P0","state":"blocked","owner_class":"context-kernel","operation_path_refs":["OP-002","OP-004"],"acceptance_refs":["AC-006"]},
    {"id":"FR-013","title":"Create durable idempotent intake identity and receipt","priority":"P0","state":"blocked","owner_class":"evidence-platform","operation_path_refs":["OP-002"],"acceptance_refs":["AC-004"]},
    {"id":"FR-014","title":"Create immutable evidence identity and preserve provenance metadata","priority":"P0","state":"blocked","owner_class":"evidence-platform","operation_path_refs":["OP-002"],"acceptance_refs":["AC-005"]},
    {"id":"FR-015","title":"Keep synchronous intake independent from model completion","priority":"P0","state":"blocked","owner_class":"evidence-platform","operation_path_refs":["OP-002","OP-003"],"acceptance_refs":["AC-009"]},
    {"id":"FR-016","title":"Return or resume the prior receipt for duplicate intake delivery","priority":"P0","state":"blocked","owner_class":"evidence-platform","operation_path_refs":["OP-002","OP-008"],"acceptance_refs":["AC-004"]},
    {"id":"FR-017","title":"Separate verbatim observation interpretation hypothesis and recommendation","priority":"P1","state":"blocked","owner_class":"research-platform","operation_path_refs":["OP-002","OP-004"],"acceptance_refs":["AC-014"]},
    {"id":"FR-018","title":"Support one canonical evidence object with multiple usage links","priority":"P1","state":"blocked","owner_class":"evidence-platform","operation_path_refs":["OP-004","OP-005"],"acceptance_refs":["AC-005","AC-014"]},
    {"id":"FR-019","title":"Preserve canonical original before derivative operations","priority":"P0","state":"blocked","owner_class":"asset-platform","operation_path_refs":["OP-002","OP-005"],"acceptance_refs":["AC-005"]},
    {"id":"FR-020","title":"Generate sanitized names without model overwrite authority","priority":"P1","state":"blocked","owner_class":"asset-platform","operation_path_refs":["OP-002"],"acceptance_refs":["AC-005"]},
    {"id":"FR-021","title":"Create deterministic content fingerprints and normalized source URLs","priority":"P1","state":"blocked","owner_class":"asset-platform","operation_path_refs":["OP-002","OP-005"],"acceptance_refs":["AC-005"]},
    {"id":"FR-022","title":"Detect exact duplicates and create semantic candidates only","priority":"P1","state":"blocked","owner_class":"evidence-intelligence","operation_path_refs":["OP-005"],"acceptance_refs":["AC-005"]},
    {"id":"FR-023","title":"Require human decision before duplicate deletion or canonical merge","priority":"P0","state":"blocked","owner_class":"evidence-review","operation_path_refs":["OP-005"],"acceptance_refs":["AC-005","AC-014"]},
    {"id":"FR-024","title":"Use explicit quarantine restricted unsorted and review states","priority":"P0","state":"blocked","owner_class":"asset-platform","operation_path_refs":["OP-002","OP-008"],"acceptance_refs":["AC-011"]},
    {"id":"FR-025","title":"Audit and read back file movement rename shortcut and access operations","priority":"P0","state":"blocked","owner_class":"asset-platform","operation_path_refs":["OP-002","OP-008"],"acceptance_refs":["AC-005","AC-010"]},
    {"id":"FR-026","title":"Represent every provider operation as a durable AI job","priority":"P0","state":"blocked","owner_class":"ai-platform","operation_path_refs":["OP-003","OP-008"],"acceptance_refs":["AC-009","AC-012"]},
    {"id":"FR-027","title":"Use logical model aliases through a provider abstraction","priority":"P0","state":"blocked","owner_class":"ai-platform","operation_path_refs":["OP-003","OP-007"],"acceptance_refs":["AC-012"]},
    {"id":"FR-028","title":"Keep production provider credentials behind a backend secret boundary","priority":"P0","state":"blocked","owner_class":"platform-security","operation_path_refs":["OP-003","OP-007"],"acceptance_refs":["AC-011","AC-012"]},
    {"id":"FR-029","title":"Declare modality sensitivity consent budget model and fallback per use case","priority":"P0","state":"blocked","owner_class":"ai-governance","operation_path_refs":["OP-003","OP-007"],"acceptance_refs":["AC-011","AC-015"]},
    {"id":"FR-030","title":"Validate structured provider output against pinned JSON Schema","priority":"P0","state":"blocked","owner_class":"ai-platform","operation_path_refs":["OP-003"],"acceptance_refs":["AC-008"]},
    {"id":"FR-031","title":"Reject semantically invalid or policy-conflicting model output","priority":"P0","state":"blocked","owner_class":"ai-governance","operation_path_refs":["OP-003"],"acceptance_refs":["AC-008"]},
    {"id":"FR-032","title":"Treat function calls as proposals requiring governed execution","priority":"P0","state":"blocked","owner_class":"platform-security","operation_path_refs":["OP-003","OP-004"],"acceptance_refs":["AC-007"]},
    {"id":"FR-033","title":"Keep AI output proposed until deterministic or human authorization","priority":"P0","state":"blocked","owner_class":"ai-governance","operation_path_refs":["OP-003","OP-004"],"acceptance_refs":["AC-007","AC-008"]},
    {"id":"FR-034","title":"Use bounded retry and readback for transient or unknown outcomes","priority":"P0","state":"blocked","owner_class":"ai-platform","operation_path_refs":["OP-003","OP-008"],"acceptance_refs":["AC-010"]},
    {"id":"FR-035","title":"Preserve manual processing when the provider is disabled","priority":"P0","state":"blocked","owner_class":"operations-platform","operation_path_refs":["OP-002","OP-008"],"acceptance_refs":["AC-009","AC-013"]},
    {"id":"FR-036","title":"Authorize and audit every human review action at object scope","priority":"P0","state":"blocked","owner_class":"evidence-review","operation_path_refs":["OP-004"],"acceptance_refs":["AC-014"]},